{
  "$schema": "https://json-schema.org/draft/2020-12/schema",
  "title": "OpenPhenology sources/1",
  "description": "Each source, its licence and how to credit it.",
  "type": "object",
  "required": [
    "id",
    "kind",
    "format",
    "provenance",
    "data"
  ],
  "properties": {
    "id": {
      "type": "string",
      "pattern": "^releases/\\d{4}-\\d{2}-\\d{2}/sources(/\\d+)?\\.json$"
    },
    "kind": {
      "const": "sources"
    },
    "format": {
      "type": "string",
      "pattern": "^sources/1\\.\\d+$"
    },
    "provenance": {
      "type": "object",
      "required": [
        "release",
        "sources",
        "licences",
        "gbif_download_dois",
        "method",
        "taxonomy",
        "boundaries",
        "ranges",
        "protection",
        "code",
        "run"
      ],
      "properties": {
        "release": {
          "type": "string",
          "pattern": "^\\d{4}-\\d{2}-\\d{2}$"
        },
        "sources": {
          "type": "array",
          "items": {
            "type": "string"
          }
        },
        "licences": {
          "type": "array",
          "items": {
            "type": "string"
          }
        },
        "gbif_download_dois": {
          "type": "array",
          "items": {
            "type": "string"
          }
        },
        "method": {
          "anyOf": [
            {
              "type": "string"
            },
            {
              "type": "null"
            }
          ]
        },
        "taxonomy": {
          "anyOf": [
            {
              "type": "string"
            },
            {
              "type": "null"
            }
          ]
        },
        "boundaries": {
          "anyOf": [
            {
              "type": "string"
            },
            {
              "type": "null"
            }
          ]
        },
        "ranges": {
          "anyOf": [
            {
              "type": "array",
              "items": {
                "type": "string"
              }
            },
            {
              "type": "null"
            }
          ]
        },
        "protection": {
          "anyOf": [
            {
              "type": "object",
              "additionalProperties": {
                "type": "string"
              }
            },
            {
              "type": "null"
            }
          ]
        },
        "code": {
          "anyOf": [
            {
              "type": "string"
            },
            {
              "type": "null"
            }
          ]
        },
        "run": {
          "anyOf": [
            {
              "type": "string"
            },
            {
              "type": "null"
            }
          ]
        }
      }
    },
    "data": {
      "type": "object",
      "required": [
        "sources"
      ],
      "properties": {
        "sources": {
          "type": "array",
          "items": {
            "type": "object",
            "required": [
              "source",
              "name",
              "kind",
              "licence",
              "licence_url",
              "use",
              "reviewed",
              "credit",
              "url"
            ],
            "properties": {
              "source": {
                "type": "string",
                "minLength": 1
              },
              "name": {
                "type": "string",
                "minLength": 1
              },
              "kind": {
                "type": "string",
                "minLength": 1
              },
              "licence": {
                "type": "string",
                "minLength": 1
              },
              "licence_url": {
                "anyOf": [
                  {
                    "type": "string",
                    "minLength": 1
                  },
                  {
                    "type": "null"
                  }
                ]
              },
              "use": {
                "type": "string",
                "minLength": 1
              },
              "reviewed": {
                "type": "string",
                "pattern": "^\\d{4}-\\d{2}-\\d{2}$"
              },
              "credit": {
                "type": "string",
                "minLength": 1
              },
              "url": {
                "type": "string",
                "minLength": 1
              }
            }
          }
        }
      }
    }
  }
}
